{
  "kind": "example_value",
  "name": "Example Title",
  "fullPath": "example_value",
  "generation": 10,
  "selfLink": "example_value",
  "addressStatus": "example_value",
  "autoLasthop": "example_value",
  "cmpEnabled": "example_value",
  "connectionLimit": 10,
  "description": "A sample description.",
  "destination": "example_value",
  "disabled": true,
  "enabled": true,
  "fallbackPersistence": "example_value",
  "gtmScore": 10,
  "ipProtocol": "example_value",
  "mask": "example_value",
  "mirror": "example_value",
  "nat64": "example_value",
  "partition": "example_value",
  "persist": [],
  "pool": "example_value",
  "profiles": [],
  "rateLimit": "example_value",
  "rateLimitMode": "example_value",
  "rules": [],
  "source": "example_value",
  "sourcePort": "example_value",
  "synCookieStatus": "example_value",
  "translateAddress": "example_value",
  "translatePort": "example_value",
  "vlansEnabled": true,
  "vlansDisabled": true,
  "vlans": [],
  "vsIndex": 10
}